title,issn,alternativeTitle
"Schulverwaltung, Niedersachsen","18652050,09401369,18652050,09401369",SchVw; Zeitschrift für Schulleitung und Schulaufsicht; SchVw NI; Schulverwaltung / Ausgabe Niedersachsen ( Hauptsacht. bis 16.2006 ); Zeitschrift für Schulleitung und Schulaufsicht ( Zusatz bis 11.2001 ); Schulverwaltung Nds ( Nebent. bis 11.2001 )
Rheinisches Museum für Jurisprudenz,"18660924,18660924","Rheinisches Museum für Jurisprudenz, Philologie, Geschichte und griechische Philosophie ( Hauptsacht. 1.1827 )"
"Blätter für Jurisprudenz, Polizey und Cultur überhaupt, besonders aber auch in denen herzogl. sächs., fürstl. Schwarzb., Fürstl. und gräfl. Reuß-Plauischen Landen","2510246X,2510246X","Blätter für Jurisprudenz, Policey und Cultur überhaupt, besonders aber auch in denen herzogl. sächs., fürstl. Schwarzb., Fürstl. und gräfl. Reuß-Plauischen Landen; Blätter für Jurisprudenz, Polizey und Cultur in Deutschland; Blätter für Jurisprudenz, Policey und Cultur überhaupt, besonders aber auch in denen herzogl. sächs., fürstl. Schwarzb., Fürstl. und gräfl. Reuß-Plauischen Landen ( Hauptsacht. 1.1800,1 ); Blätter für Jurisprudenz, Polizey und Cultur in Deutschland ( Hauptsacht. 2.1801,1 ); Blätter für Jurisprudenz, Polizei und Cultur in Deutschland ( Zitiert. nach Kirchner )"
Kritische Zeitschrift für die gesammte Rechtswissenschaft,"23646055,23646055",
Urteils-Ticker Betriebsrat,"18623336,18623336",der aktuelle Rechtsprechungs-Report für Ihre erfolgreiche Mitarbeitervertretung
eGov Präsenz,14249715,Fachzeitschrift des E-Government-Instituts; Fachzeitschrift des Kompetenzzentrums eGovernment ( Zusatz anfangs ); Fachzeitschrift des Kompetenzzentrums Public Management und eGovernment / ( Zusatz später )
Jahrbücher für die Dogmatik des heutigen römischen und deutschen Privatrechts,"18660800,18660800",Jherings Jahrbücher
Steuern der Energiewirtschaft,"14371553,14371553",StE
Schriften zum Wirtschafts- und Arbeitsrecht,03440567,
Deutsche Zoll- und Polizeizeitschrift,"09338519,09338519",
Summa summarum,"14342901,14342901",Meldungen; Beiträge; Versicherung; Prüfung von A - Z
Potsdamer UNO-Konferenzen,"16174704,16174704",
Wirtschaftsrecht aktuell,"18612652,18612652","das Neueste aus Recht, Haftung, Steuern, Finanzierung für klein- und mittelständische Unternehmen ( Zusatz bis 2008,10 ); unverzichtbare Informationen für Ihren unternehmerischen Erfolg ( Zusatz anfangs )"
Kritische Überschau der deutschen Gesetzgebung und Rechtswissenschaft,"23646063,23646063",
"Karriereführer, Finanzdienstleistungen","18646301,18646301",Berufseinstieg für Hochschulabsolventen ( Zusatz anfangs )
Personal aktuell im öffentlichen Dienst,"18630626,18630626","wichtige Informationen für Personalverantwortliche imöffentlichen Dienst über alle neuen Urteile, Gesetze und den TVöd ( Zusatz anfangs ); wichtige Informationen und Urteile für Personalverantwortliche, Amts- und Behördenleiter für eine erfolgreiche und rechtssichere Personalarbeit ( Zusatz früher )"
Der Patientenschützer,26998270,Der Patientenschützer vertraulich
"Ausbildung, Prüfung, Fachpraxis, Gesamtausgabe","18676995,18676995","Ausbildung, Prüfung, Fachpraxis / Gesamtausgabe; Apf"
Redmark - der Verein aktuell,"18696252,18696252",Der Verein aktuell
"Schriften zum Wirtschafts-, Arbeits- und Sozialrecht",07214847,
Neue juristische Bibliothec,"25099213,25099213",Neue juristische Bibliothek
Des hochlöbl. schwäb. Crayses allgemeines Adresse-Handbuch,"27004228,27004228","Des hochlöblichen schwäbischen Kreises allgemeines Adreßhandbuch : oder deutliche Anzeige, was in denen eigentlich zu diesem Kreis gehörigen Landen und Herrschaften dermalen für höchste und hohe Regenten, Ministri, Räte ... sind"
Schriftenreihe der Juristischen Studiengesellschaft Hannover,09322256,Schriftenreihe ( Hauptsacht. 1.1978 )
Frankfurter kriminalwissenschaftliche Studien,01706918,
Schweizerische Zeitschrift für Zivilprozess- und Zwangsvollstreckungsrecht,16609077,ZZZ; PCEF
"OLG-Report Frankfurt, Koblenz, Zweibrücken, Saarbrücken",09419446,"OLG-Report Frankfurt ( Hauptsacht. bis 14.2005,6 ); Schnelldienst zur Zivilrechtsprechung des OLG Frankfurt ( Zusatz anfangs )"
Der Lebensmittelkurier,"09457615,09457615",LMK
"Der Steuerzahler, [Ausgabe Baden-Württemberg]",07248040,"Der Steuerzahler <Wiesbaden> / Baden-Württemberg; Nachrichten des Bundes der Steuerzahler; Monatsschrift des Bundes der Steuerzahler; Für vernünftige Steuerpolitik, gegen Mißbrauch von Steuergeldern"
Des hochlöbl. schwäbischen Kreises vollständiges Staats- und Addreß-Buch,"25108379,25108379",Des hochlöbl. schwäb. Crayses vollständiges Staats- und Addresse-Handbuch ( Hauptsacht. 1766 ); Des hochlöbl. schwäbischen Crayses vollständiges Staats- und Addreß-Buch ( Hauptsacht. 1771 - 1777[?] )
BKK-Gesundheitsreport,"29419727,29419727",BKK Gesundheitsreport
"Innovative Verwaltung, Special","16189884,16189884",Innovative Verwaltung / Special; Mach-Special ( Sachl. Benennung teils ); IT-Praxis-Special ( Sachl. Benennung teils ); Service-Center-Special ( Sachl. Benennung teils )
Arbeitsschutz-Profi aktuell,"18628931,18628931","Arbeitsschutz-Profi; Arbeitsschutz, Anlagensicherheit, Gefährdungsbeurteilung, rechtssichere Unterweisung; Der Arbeitsschutz-Profi aktuell ( Haupttitel früher )"
Jahresbericht / Menschenrechtszentrum der Universität Potsdam,21915857,
KG-Report Berlin,09438106,Report
Baurechtssammlung,07218451,"BRS; Baurechtsammlung ( Hauptsacht. 1.1945/50 - 6.1956 ); BRS ( 1. Zusatz 80.2012 ); Rechtsprechung des Europäischen Gerichtshofs sowie des Bundesverfassungsgerichts, Bundesverwaltungsgerichts und der Oberverwaltungsgerichte ( 2. Zusatz 80.2012 )"
Münchner geschichtsdidaktisches Kolloquium,14331470,
Unpartheyische Critik über die neuesten juristischen Schriften,"23669292,23669292","D. August Friedrich Schotts, der Altertümer des Rechtsöffentlichen Professors zu Leipzig, unparteiische Kritik über die neuesten juristischen Schriften; Schotts, der Alterthümer des Rechtsöffentlichen Professors zu Leipzig, unpartheyische Critik über die neuesten juristischen Schriften; Unparteische Kritik über die neuesten juristischen Schriften; D. August Friedrich Schotts, der Alterthümer des Rechtsöffentlichen Professors zu Leipzig, unpartheyische Critik über die neuesten juristischen Schriften ( Hauptsacht. bis 8.1776/78 )"
"Enzyklopädie der Rechts- und Staatswissenschaft, Abteilung Rechtswissenschaft","25125109,25125109",
Umsatzsteuer intern,"21914699,21914699","für Unternehmer und Steuerberater ; kreativ, praxisnah, aktuell, vertraulich, international"
Freiburger Veröffentlichungen zum Religionsrecht,14226626,
Bibliothek für die peinliche Rechtswissenschaft und Gesetzkunde,"23651296,23651296",Bibliothek des peinlichen Rechts der peinlichen Gesetzgebung und Gesetzkunde ( Hauptsacht. d. Repr. 1804 )
Schriften zum Personalwesen,03440559,SPW
Rechtsmedizin,"09379819,09379819",Rechtsmedizin <Heidelberg>
Bochumer Forschungsberichte Berg- und Energierecht,09383492,Bochumer Forschungsberichte zum Berg- und Energierecht ( Haupttitel Band 1 (1990)-26 (2005) )
Zeitschrift für deutsches Staatsrecht und deutsche Verfassungsgeschichte,"18661556,18661556",
Prüfe dein Wissen,27004570,Rechtsfälle und Fragen mit Antworten ( Zusatz anfangs ); Rechtsfälle mit Fragen und Antworten ( Zusatz teils )
Sächsisches Ausschreibungsblatt,"09469958,09469958",
Beiträge zum Zivilprozeßrecht,07234309,BeitrZPR; Linzer Universitätsschriften / Beiträge zum Zivilprozeßrecht
Bericht über die Verwaltung des Frauen-Siechenhauses Bethesda,2700726X,"Bericht über die Verwaltung des Siechenhauses Bethesda ( Haupttitel [1.]1854/58(1859), 3.1861/64(1865) u. 1865(1866) )"
"Schriften zum deutschen und europäischen Zivil-, Handels- und Prozeßrecht",05589118,
"Kritische Vierteljahresschrift für Gesetzgebung und Rechtswissenschaft, Sonderheft",01792830,
Schriften zur Gesundheitspolitik und zum Gesundheitsrecht,"21930465,21930465",
"Beiträge zur Erläuterung des preußischen Rechts, des Handels- und Wechselrechts durch Theorie und Praxis","1866055X,1866055X",
Sammlung der Reichs-Hof-Raths-conclusorum,"27495728,27495728",Sammlung derer Reichs-Hof-Raths-conclusorum ( Hauptsacht. 1760 )
AdVoice,"14373084,14373084",Datenbank für junge Rechtsanwälte ( Zusatz anfangs ); Mitteilungsblatt des Forums Junge Rechtsanwältinnen und Rechtsanwälte im Deutschen Anwaltverein e.V. ( Zusatz anfangs ); Mitteilungsblatt des Forum Junge Anwaltschaft im Deutschen Anwaltverein e.V. ( Zusatz früher )
Schweizerische Zeitschrift für Zivilprozessrecht,16608909,Revue suisse de procédure civile; Rivista svizzera di procedura civile; SZZP; RSPC; Swiss journal of civil procedure ( Parallelsacht. )
Die Schwerbehindertenvertretung,"21943370,21943370",
Magazin für das deutsche Staats- und Lehenrecht,"2510022X,2510022X",
Allgemeine staatswissenschaftliche und juristische Literatur-Zeitung,"2510232X,2510232X",
Archiv für das natürliche und positive Völkerrecht,"25102362,25102362",
Teutsches Staats-Magazin,"25102389,25102389",Deutsches Staats-Magazin
Forschung aktuell,"26264870,26264870",
Bank-Praktiker,"18614884,18614884","Bankpraktiker; WIKI; unabhängig, lösungsorientiert, kompakt ( 1. Zusatz bis 2009,7/8 ); Fachwissen für das Aktiv- und Passivgeschäft ( 2. Zusatz bis 2009,7/8 )"
Kleine juristische Bibliothek oder ausführliche Nachrichten von neuen kleinern iuristischen vornehmlich akademischen Schriften,"21930759,21930759","Ausführliche Nachrichten von neuen kleinern iuristischen, vornehmlich akademischen Schriften"
Niedersächsisches Archiv für Jurisprudenz und juristische Litteratur,"25100300,25100300",
"Juristisches Magazin oder gesammelte, theils gedruckte, theils ungedruckte Abhandlungen aus allen Theilen der Rechtsgelahrtheit","25102346,25102346",
Schriften zu Organisation und Personal,09382755,
Juristisches Magazin für die deutschen Reichsstädte,"23665920,23665920",
Zeitungen für Rechtsgelehrte,"2366522X,2366522X",
Beyträge zur Berichtigung und Erweiterung der positiven Rechtswissenschaften,"21935602,21935602",Beiträge zur Berichtigung und Erweiterung der positiven Rechtswissenschaften; Beiträge zur Berichtigung der positiven Rechtswissenschaften ( Zitiert. lt. Kirchner )
"Beiträge zur Gesetzgebung und praktischen Jurisprudenz, mit besonderer Rücksicht auf Bayern","21929491,21929491","Beiträge zur Gesetzgebung und practischen Jurisprudenz, mit besonderer Rücksicht auf Bayern ( Hauptsacht. bis 2.1828 )"
Jus publicum,"09410503,09410503",IusPubl; JusPubl
"Das 2. juristische Staatsexamen, Referendartips, [Ausgabe Nordrhein-Westfalen]",09329390,
Criminal digest,09330186,
Leipziger Schriften zum öffentlichen Recht,"21953821,21953821",
Staats-Archiv,"23652888,23652888",
Allgemeine Bibliothek der neuesten juristischen Litteratur,"23671688,23671688",
Archiv der Kirchenrechtswissenschaft,"23651288,23651288",
Litterarische Annalen der Rechtswissenschaft,"2367136X,2367136X",
Beyträge zum Cammergerichtlichen Justizwesen,"25100289,25100289",Beiträge zum kammergerichtlichen Justizwesen; Beyträge zum kammergerichtlichen Justizwesen ( Hauptsacht. teils )
Beiträge zur Kenntniß der Justizverfassung und juristischen Literatur in den preussischen Staaten,"21930716,21930716",
"Archiv merkwürdiger Rechtsfälle und Entscheidungen der rheinhessischen Gerichte mit vergleichender Berücksichtigung der Jurisprudenz von Frankreich, Rheinbaiern und Rheinpreußen","23668245,23668245",
Recht & Sicherheit in der Landwirtschaft,"23640820,23640820","Recht und Sicherheit in der Landwirtschaft; Agrar-Wissen ( Haupttitel 2019, 7-2019, 8 )"
Beyträge zur Geschichte der teutschen Justizpflege im achtzehnten Jahrhundert,"23665289,23665289",Beiträge zur Geschichte der deutschen Justizpflege im achtzehnten Jahrhundert
Schriftenreihe des Deutschen Sozialrechtsverbandes,1864015X,SDSRV
"Allgemeine Bibliothek für Staatskunst, Rechtswissenschaft und Critik","18660983,18660983",
Der Detektiv,17274745,
Des hochlöbl. schwäbisch- und fränkischen Crayses vollständiges Staats- und Addreß-Buch,"25108379,25108379",
NomoK_372non,"27492826,27492826",NomoKanon; 25 Jahre NomoK_372non
Schriften zur Rechtslehre und Politik,00807060,Schriften zur Rechtslehre und Politik des Seminars für Staatsphilosophie und Rechtspolitik der Universität Köln ( Hauptsacht. teils )
Umweltrecht in der Praxis,14209209,
Allgemeine Bibliothek der neuesten juristischen Litteratur,"2367167X,2367167X",
"Zeitschriften-Auswertung, Ergänzungsheft ... vornehmlich für Referendare und Praktiker","01760912,01760912",Zeitschriften-Auswertung / Ergänzungsheft ... vornehmlich für Referendare und Praktiker; Ergänzungsheft ... vornehmlich für Referendare und Praktiker; ZA
Körperschaftsteuer-Handausgabe,01786687,Körperschaftsteuer Handausgabe
Untersuchungen zur Ordnungstheorie und Ordnungspolitik,"1434338X,1434338X",UOrd
Journal für Gesetzkunde und Rechtsgelehrsamkeit,16118898,
ExperSite,23645644,
Verwaltung heute,09351248,"Verwaltung ( Hauptsacht. 36.1988,1-5 )"
The journal of state government,10432248,
Rinderzucht Berlin-Brandenburg,"14359014,14359014",RZ
Arbeiten zur Rechts- und Sprachwissenschaft,16118588,
BDVR-Rundschreiben,"25117599,25117599",Rundschreiben
Bibliothek für positive Rechtswissenschaft und Diplomatik,"21929572,21929572",
"Polizeispiegel, Bayern","07232209,07232209",Kurier für die Polizei des Landes Bayern; Kurier für die Polizei des Freistaats Bayern; Fachorgan der Deutschen Polizeigewerkschaft im Deutschen Beamtenbund
Forum Europarecht,14224283,
Straßenwärter,"18668739,18668739",
Asyl,14228181,schweizerische Zeitschrift für Asylrechtspraktiker
Schriften des Betriebs-Berater,04876881,Schriften des Betriebs-Beraters ( Hauptsacht. anfangs )
Rechtsprechung spezial Praxis des Erbrechts,09462953,EPrax
Beyträge zu neuen Erfahrungen der Rechts- und Gesetzkunde oder Jahrgänge der Rechtspflege bey den Holsteinischen Obergerichten,"23671416,23671416","Rechtspflege bey den Holsteinischen Obergerichten; Beiträge zu neuen Erfahrungen der Rechts- und Gesetzeskunde, oder Jahrgang der Rechtspflege bei dem Holsteinischen Obergericht; Beiträge bei neuen Erfahrungen der Rechts- und Gesetzeskunde, oder Jahrgang der Rechtspflege bei dem Holsteinischen Obergericht; Beiträge zu neuen Erfahrungen der Rechts- und Gesetzeskunde, oder Jahrgang der Rechtspflege bei dem Holsteinischen Obergericht ( Zitiert. nach Kirchner )"
Rheinpfälzisch-patriotische Miscellen in zwanglosen Heften,"25098489,25098489",
"Die Fundstelle, Niedersachsen",07211376,Ausgabe Niedersachsen ( Sachl. Benennung bis 26.1973 ); Fundstellennachweis und Erläuterungen aller wichtigen Vorschriften für die Gemeindeverwaltung in Niedersachsen ( Zusatz bis 24.1971 )
Diplomatisch-practische Beyträge zu dem deutschen Lehnrecht und zu der westphälischen Fehmgerichts-Verfaßung,"21926409,21926409",Diplomatisch-praktische Beiträge zum deutschen Lehnrecht
Ex libris,"0014391X,0014391X","Exlibris; aktueller studentischer Buchdienst ( Zusatz anfangs ); aus Rechts-, Wirtschafts- und Sozialwissenschaften ( 1. Zusatz früher ); aktueller Bücherdienst für Studenten ( 2. Zusatz früher )"
Berichte / Fachhochschule des Bundes für Öffentliche Verwaltung,09462988,
"Praxis aktuell, Das Unternehmermagazin der AOK Bremen/Bremerhaven","14379171,14379171","Praxis aktuell <Essen> / Unternehmer-Magazin der AOK Bremen/Bremerhaven; PA; Unternehmer-Magazin der AOK Bremen/Bremerhaven ( Sachl. Benennung bis 2009,3 )"
Tijdschrift voor rechtsgeschiedenis,15718190,Tijdschrift voor rechtsgeschiedenis; The legal history review ( Haupttitel früher )
Bibliothek für die peinliche Rechtswissenschaft und Gesetzkunde,"2365130X,2365130X",
Neues Archiv des Criminalrechts,"23652721,23652721",Neues Archiv des Kriminalrechts
Litterarische Annalen der Rechtswissenschaften,"23671378,23671378",Annalen der Rechtswissenschaft; Literarische Annalen der Rechtswissenschaft; Literarische Annalen der Rechtswissenschaft ( Zitiert. nach Kirchner )
Magazin für die Geschichte der Menschenrechte,"23664339,23664339",
Staats- und Adreß-Handbuch des hochlöbl. schwäbischen Kreises,"27501132,27501132",Schwäbisches Staats- und Adreß-Handbuch
Die Einkommensteuer-Richtlinien ...,"04247019,04247019",
Beiträge zu Kriminologie und Strafrecht,"16109538,16109538",
OLG-Report Köln,09402160,Report
Global security,"21930821,21930821",GS
Zeitschrift für Gesetzgebung und Rechtspflege in Preußen,"1866167X,1866167X",
Schriften zum deutschen und europäischen Arbeitsrecht,"1865634X,1865634X",
"Wistra, Wistra-Kartei","01767283,01767283","Zeitschrift für Wirtschaft, Steuer, Strafrecht; Wistra-Kartei; Rechtsprechung zum Wirtschafts- und Steuerstrafrecht"
Zeitschrift für Gesetzgebung und Praxis auf dem Gebiete des deutschen öffentlichen Rechtes,"18661572,18661572",
Jahrbücher der deutschen Rechtswissenschaft und Gesetzgebung,09316396,
Kritische Zeitschrift für Rechtswissenschaft und Gesetzgebung des Auslandes,"18660908,18660908",
Der IT-Rechtsberater,"16171802,16171802","ITRB; Der IT-Rechts-Berater; Informationsdienst für die EDV-, Multimedia- und TK-rechtliche Beratungspraxis"
Hallische Beyträge zu der juristischen Gelehrten-Historie,"25096257,25096257",Hallische Beiträge zu der juristischen gelehrten Historie ( Hauptsacht. teils )
Johann Jacob Mosers vermischte Berichte von Religions-Sachen,"25099175,25099175",Mosers vermischte Berichte von Religions-Sachen; Vermischte Berichte von Religions-Sachen
Beyträge zu der juristischen Litteratur in den preußischen Staaten,"25103350,25103350",Beiträge zu der juristischen Litteratur in Preussen ( Hauptsacht teils ); Beyträge zur juristischen Litteratur in den preussischen Staaten ( Zitiert. lt. Kirchner )
Blickpunkt Rind,"18613969,18613969",
Nebenstunden von teutschen Staatssachen,"23666447,23666447",
Neueste juristische Literatur,"25100149,25100149",Neueste juristische Litteratur ( Hauptsacht. teils )
"Samlung merkwürdiger Rechtshändel samt ihren Zweifels- und Entscheidungsgründen, wie auch verschiedener Rechts- und anderer Materien","23654635,23654635","Sammlung merkwürdiger Rechtshändel, samt ihren Zweifels- und Entscheidungsgründen; Sammlung merkwürdiger Rechtshändel, samt ihren Zweifels- und Entscheidungsgründen ( Zitiert. nach Kirchner )"
"Nachrichten und unvorgreifliche Gedanken von den hamburgischen Gerichten, Gesetzen und Anwälden","23671270,23671270",
Sächsisches Archiv für bürgerliches Recht und Prozeß,"18662072,18662072",
"Magazin der Gesetzgebung, besonders in den königl. preußischen Staaten","25103334,25103334",
Altfriesische Rechtsquellen,05691427,
Deutsch-georgische Strafrechtszeitschrift,"25665758,25665758",DGStZ
Münstersche Schriften zur Kooperation,16176561,
Schriften des BDÜ,"14382164,14382164",Schriften des Bundesverbandes der Dolmetscher und Übersetzer e.V. (BDÜ) ( Hauptsacht. anfangs )
DVR Report,"09409025,09409025",DVR-Report ( Haupttitel früher )
Zeitschrift für die deutsche Gesetzgebung und für einheitliches deutsches Recht,"18661661,18661661",
Arbeitgeber intern,"25093568,25093568",
Sammlung der neuesten und wichtigsten Deductionen in teutschen Staats- und Rechts-Sachen,"27495264,27495264",
Deductions-Bibliothek von Teutschland nebst dazugehörigen Nachrichten,27012131,Deduktions-Bibliothek von Deutschland nebst dazugehörigen Nachrichten
"Thesaurus iuris Franconici, oder Sammlung theils gedruckter, theils ungedruckter Abhandlungen, Dissertationen ..., welche das fränkische und besonders hochfürstlich-wirzburgische geistliche, weltliche, bürgerliche, peinliche, Lehen-, Polizey- und Kameralrecht erläutern, Abschnitt 2","26998343,26998343","Sammlung theils gedruckter, theils ungedruckter Abhandlungen, Dissertationen ..., welche das fränkische und besonders hochfürstlich-wirzburgische geistliche, weltliche,  bürgerliche, peinliche, Lehen-, Polizey- und Kameralrecht erläutern"
"Thesaurus iuris Franconici, oder Sammlung theils gedruckter, theils ungedruckter Abhandlungen, Dissertationen ..., welche das fränkische und besonders hochfürstlich-wirzburgische geistliche, weltliche, bürgerliche, peinliche, Lehen-, Polizey- und Kameralrecht erläutern, Abschnitt 1","26998068,26998068","Sammlung theils gedruckter, theils ungedruckter Abhandlungen, Dissertationen ..., welche das fränkische und besonders hochfürstlich-wirzburgische geistliche, weltliche,  bürgerliche, peinliche, Lehen-, Polizey- und Kameralrecht erläutern"
IPA working paper,23650362,Institut für Prozess- und Anwaltsrecht working paper
Paten,01762982,
Juridisches Magazin,"18661025,18661025","Juridisches Magazin, insbesondere für die Großherzoglich Badischen Lande"
Rechtssicher pflegen aktuell,"1864693X,1864693X",
Hilfsmittel zum Ostrecht,04391411,
Frankfurter öffentlich-rechtliche Studien,"01716697,01716697",
Law and legislation in the German Democratic Republic,04588460,
Beyträge zum teutschen Rechte,"21929823,21929823",Beiträge zum deutschen Recht; Beyträge zum teutschen Recht ( Hauptsacht. 1.1786 u. 4.1789 )
Staatswissenschaftliche und juristische Litteratur,"25098446,25098446",
Teutsche Stats-Literatur,"23671424,23671424",
Polizei heute,01761242,
"Praxis aktuell, Unternehmer-Magazin der AOK im Saarland","09356746,09356746",
"Monumenta Germaniae historica, 7: Leges : Rechtstexte. Fontes iuris Germanici antiqui",05449871,
Studien zum deutschen und internationalen Familien- und Erbrecht,"1864497X,1864497X",
Schadenpraxis,"10191151,10191151",SP; Schadenspraxis ( Hauptsacht. teils )
Schriftenreihe der SRH-Hochschule Heidelberg,"18669034,18669034",
Zeitschrift für wissenschaftliche Bearbeitung des preußischen Rechtes,"18661637,18661637","Materialien des allgemeinen Landrechts zu den Lehren vom Gewahrsam und Besitz, und von der Verjährung"
Archiv des Criminalrechts,"2366584X,23665823,2366584X,23665823",Archiv des Kriminalrechts
Mannheimer Anzeiger,"27474682,27474682",
Magazin für die Gerechtsame des Adels und der Rittergüter in Deutschland,"23652845,23652845",
Sächsisches Archiv für deutsches bürgerliches Recht,"18662137,18662137",
Die Steuer-Quellen,09331123,
Das Steuer-Forum für die steuer- und wirtschaftsberatenden Berufe,09331115,
"Der Betrieb, Arbeitsrecht","25679945,25679945",
Zeitschrift für das gesamte Handelsrecht und Wirtschaftsrecht,00442437,ZHR; Zeitschrift für Handelsrecht und Wirtschaftsrecht
"Zeitschrift der Savigny-Stiftung für Rechtsgeschichte, Germanistische Abteilung",23044861,Zeitschrift der Savigny-Stiftung für Rechtsgeschichte / Germanistische Abteilung
Archiv für die Rechtspflege und Gesetzgebung im Großherzogthum Baden,"2192743X,2192743X",Archiv für Rechtspflege und Gesetzgebung im Grossherzogthum Baden ( Hauptsacht. teils )
TVöD kompakt,"18632319,18632319",Kompakt TVöD
"Ausgewählte Entscheidungen des Obersten Rückerstattungsgerichts, Zweiter Senat (Herford, Westf.)",04709233,Auswahl der erlassenen Entscheidungen; Selection of decisions
"Amtsblatt / Bayerisches Staatsministerium für Ernährung, Landwirtschaft und Forsten",04086953,"LMBl; Amtsblatt des Bayerischen Staatsministeriums für Ernährung, Landwirtschaft und Forsten ( Hauptsacht. bis 19.1975 )"
Soziale Krankenversicherung,07218028,SKV
Juristisch-mathematisches Magazin,"23664398,23664398",
Juristisches Journal,"23671319,23671319",
Neueste landschaftliche Bibliothek für Baiern,"25102443,25102443",
Magazin für die Philosophie des Rechts und der Gesetzgebung,"21926468,21926468",
Archiv des preußischen Rechts,"23668210,23668210",
Blätter zur Kunde des Preussischen Staates und seiner Verfassung,"25098535,25098535",
Archiv für das Notariat,"23665777,23665777",
Juristische Schriftenreihe,23078545,
Magazin für deutsche gerichtliche und Polizeibeamte,"23665904,23665904","Magazin für deutsche gerichtliche und Polizeibeamte, welche sich mit der französischen peinlichen Gesetzgebung und dem Gerichtsgang in peinlichen Sachen bekannt zu machen wünschen ( Auf d. Bd.-Titelbl. )"
Aspekte,03401995,Zeitschrift für Berufsberatung; Zeitschrift für Studienanfänger ( Zusatz anfangs )
Schriftenreihe der Deutschen Vereinigung für Jugendgerichte und Jugendgerichtshilfen,09423516,Schriftenreihe der Vereinigung für Jugendgerichte und Jugendgerichtshilfen ( Hauptsacht. 5.1926; 7.1926 - 11.1927 ); Schriftenreihe der DVJJ ( Hauptsacht. teils )
Magazin für das Civil- und Criminal-Recht des Königreichs Westphalen,"18660916,18660916","Magazin der französischen und westfälischen Jurisprudenz ( Hauptsacht. 5.1813,1 )"
Archiv für die Gesetzgebung und Reforme des juristischen Studiums,"21929564,21929564",Archiv für die Gesetzgebung und Reform des juristischen Studiums
Jahrbücher der Gesetzgebung und Rechtspflege im Königreich Württemberg,"21935599,21935599",
Criminalistische Beyträge,"23653639,23653639",Kriminalistische Beiträge; Criminalistische Beiträge; Criminalistische Beiträge ( Zitiert. nach Kirchner )
"Der Steuerzahler, [Ausgabe Rheinland-Pfalz]","01706888,01706888",Monatszeitschrift des Bundes der Steuerzahler
"Niederrheinisches Archiv für Gesetzgebung, Rechtswissenschaft und Rechtspflege","23653574,23653574",
Allgemeine juristische Monatsschrift für die preussischen Staaten,09357351,
Magazin gemeinnütziger Beobachtungen und interessanter Rechtsfälle in Koncurssachen,"23668393,23668393",
Abhandlungen civilistischen und criminalistischen Inhalts,16117050,"Abhandlungen zivilistischen und kriminalistischen Inhalts; Zeitschrift für Zivil- und Kriminalrecht, in gleichmässiger Rücksicht auf Geschichte und Anwendung des Rechts, auf Wissenschaft und Gesetzgebung; Zeitschrift für Civil- und Criminalrecht, in gleichmässiger Rücksicht auf Geschichte und Anwendung des Rechts, auf Wissenschaft und Gesetzgebung"
Ersatzkassen-Report,"01702793,01702793",
Archiv für katholisches Kirchenrecht,2589045X,
Beyträge zur Kenntniß des vaterländischen Rechts,"18660142,18660142",
Magazin für die Philosophie und Geschichte des Rechts und der Gesetzgebung,"18661823,18661823",Grolmans Magazin
