title,issn,alternativeTitle
Gewerbearchiv,"00169404,00169404","mit Vierteljahresbeilage ""Wirtschaft und Verwaltung""; GewArch"
Intertax,01652826,
Süddeutsche Juristen-Zeitung,0340692X,
"Archiv für Rechts- und Sozialphilosophie, Beiheft","0341079X,0341079X",ARSP
"Gewerblicher Rechtsschutz und Urheberrecht, Internationaler Teil : GRUR Int. : mit Inhalten des Journal of intellectual property law practise / Max-Planck-Institut für Innovation und Wettbewerb","04358600,04358600",GRUR; GRUR Int; Gewerblicher Rechtsschutz und Urheberrecht / Auslands- und internationaler Teil; GRURInt; Auslands- und internationaler Teil ( Sachl. Benennung bis 1966 ); GRUR Ausl. ( Nebent. bis 1966 ); GRUR international ( Nebent. ab 1980 )
Vergaberecht,"16171063,16171063","Das gesamte Vergaberecht ( Hauptsacht. 1.2001,1 ); Zeitschrift Vergaberecht ( Zusatz anfangs )"
Veröffentlichungen der Vereinigung der Deutschen Staatsrechtslehrer,"25670557,25670557",VVDStRL; Veröffentlichung der Vereinigung der Deutschen Staatsrechtslehrer ( Hauptsacht. teils )
Gemeinde und Sport,04352041,Jahrbuch
Strafrechtliche Abhandlungen,07207271,SRA ( Nebent. teils )
Kindesmisshandlung und -vernachlässigung,"14369850,14369850",Gemeinsam stark für den Kinderschutz!; Interdisziplinäre Fachzeitschrift der DGgKV ( Nebent. teils )
IT-Sicherheit,"18685757,18685757",Fachmagazin für Informationssicherheit und Compliance; Praxis der Daten- und Netzsicherheit; Management der Daten- und Netzsicherheit; Fachmagazin für Informationssicherheit und Datenschutz; Mittelstandsmagazin für Informationssicherheit und Datenschutz; Magazin für Informationssicherheit und Datenschutz
Die Ersatzkasse,"00140279,00140279",
Durchblick,09467483,
"Polizeispiegel, Baden-Württemberg","07231830,07231830",Fachorgan der Deutschen Polizeigewerkschaft im Deutschen Beamtenbund
"Magazin für das Kirchenrecht, die Kirchen- und Gelehrten-Geschichte nebst Beyträgen zur Menschenkenntniß überhaupt","23665246,23665246",
Verkehrsrecht aktuell,"16153995,16153995",VA
"Neueste fortgesetzte juristische Bibliothek, vornehmlich des deutschen Staats- und Kirchenrechts","23653485,23653485",
BBW-Magazin,14379856,Magazin; Monatszeitschrift des Beamtenbundes Baden-Württemberg für den öffentlichen Dienst ( Zusatz anfangs )
Transport- + Speditionsrecht,01705636,TranspR; Transport- und Speditionsrecht
Amtliches Schulblatt für den Regierungsbezirk Arnsberg,07236719,
Meißner Tageblatt,09400516,
Vorteile,"26295032,26295032",
Computer law review international,"21944164,21944164",CRi; Computer und Recht international ( Hauptsacht. bis 2002 )
Sächsisches Gesetz- und Verordnungsblatt,09413006,
Humanitäres Völkerrecht,"2625719X,2625719X",HuV
Amtsblatt der Stadt Essen,04214714,
Computer und Recht,21944172,CR
Handbuch der Freien und Hansestadt Hamburg,0340028X,Handbuch der Hansestadt Hamburg ( Hauptsacht. 1939 ); Hamburg-Handbuch ( Nebent. 1971 )
Oberbayerisches Amtsblatt,09442316,
Das Rechtswesen ...,"01740326,01740326",Statistik von Baden-Württemberg / Das Rechtswesen
Amtsblatt der Freien Hansestadt Bremen,05244242,
Journal officiel de Haute-Silésie,08672571,
Kriminologisches Journal,"03411966,03411966",Krim J
Jahrbuch / Komitee für Grundrechte und Demokratie,01767003,
Der Beamtenbund,"04051033,04051033",
Archiv des öffentlichen Rechts,"00038911,00038911",
Zeitschrift für Zölle und Verbrauchsteuern,"03423484,03423484",ZfZ; Steuerstrafrecht; Zeitschrift für Zölle und Verbrauchssteuern ( Hauptsacht. anfangs ); Zeitschrift für Zölle + Verbrauchsteuern ( Hauptsacht. auf d. Jg.-Titelbl. später ); Rundschau für Außenwirtschaft und Finanzpolitik ( Zusatz anfangs )
Familie und Recht,"23662018,23662018",FuR
"Deutsche Polizei, Ausgabe Schleswig-Holstein","01706497,01706497",Deutsche Polizei <Hilden> / Ausgabe Schleswig-Holstein; Organ der Gewerkschaft der Polizei
VDJ-Forum,01782908,"Forum; VDJ-Forum / Vereinigung Demokratischer Juristen in der Bundesrepublik Deutschland ( Hauptsacht. 1981,1 ); VDJ-Forum / Vereinigung Demokratischer Juristinnen und Juristen in der Bundesrepublik Deutschland und Berlin (West) ( Hauptsacht. 1986,4 )"
Jahrbuch / Internationale Gesellschaft für Urheberrecht,05391512,Resolutionen; Anuario; Annuario
Alternative Kommunalpolitik,"07225474,07225474",AKP
Entscheidungsanmerkungen zum Wirtschafts- und Bankrecht,"14370344,23647310",WuB
BFH-NV,09458719,"BFH NV; BFH NV auf CD-ROM ( Nebent. teils ); Sammlung amtlich nicht veröffentlichter Entscheidungen des Bundesfinanzhofs ( Zusatz 1985/93 ); mit den amtlich veröffentlichten Entscheidungen aus der juris-Datenbank ab ... ( Zusatz 1985/94 - 1985/98 ); Sammlung aller Entscheidungen des Bundesfinanzhofs auf CD-ROM ( Zusatz 1985/94 - 1985/98 ); die elektronische Sammlung der Entscheidungen des Bundesfinanzhofs ab ... ( Zusatz später ); die Sammlung der Entscheidungen des Bundesfinanzhofs ab ... ; mit allen anhängigen Steuerverfahren beim BFH, EuGH und BVerfG ( Zusatz später ); mit allen anhängigen Steuerverfahren beim BFH und BVerfG ( 2.Zusatz später )"
Selbstverwaltung der Ortskrankenkassen,03448207,SdO. 1953-1988
"Staatshandbuch, Baden-Württemberg : Handbuch der Landes- und Kommunalverwaltung mit Aufgabenbeschreibungen und Adressen",18603580,Staatshandbuch / Baden-Württemberg; Staatshandbuch die Bundesrepublik Deutschland
Internetagent,18612385,
Kanzleiführung professionell,"14324903,14324903","KP; KP; aktives Kanzleimanagement, Honorarpolitik, Gebührenrecht des Steuerberaters ( 2. Zusatz anfangs )"
Berliner Forum Gewaltprävention,16170253,
Sächsisches Gesetz- und Verordnungsblatt,09413006,SächsGVBl. SN
Bayerische Gemeindezeitung,"00057045,00057045",Gemeindezeitung; GZ
Archiv für Rechts- und Sozialphilosophie,"00012343,00012343",ARSP; Archivo de filosofía jurídica y social
BDF aktuell,"09456538,09456538","Aktuell; Zeitschrift des Bundes Deutscher Forstleute für Forstpolitik, Forstwirtschaft, Natur und Umwelt ( Zusatz anfangs )"
Europäische Grundrechte-Zeitschrift,"03419800,03419800",EuGRZ; Grundrechte; Grundrechte - die Rechtsprechung in Europa ( Hauptsacht. 1.1974 - 3.1976 )
Gewerbearchiv,00169404,GewArch
Arbeitsmarkt,14399474,"Arbeitsmarktanalyse für die alten und die neuen Bundesländer ( Zusatz anfangs ); Arbeitsmarktanalyse für das Bundesgebiet insgesamt, die alten und die neuen Bundesländer ( Zusatz teils ); Arbeitsmarktanalyse für das Bundesgebiet insgesamt, West- und Ostdeutschland ( Zusatz teils )"
Bayerisches Justizministerialblatt / Bayerisches Staatsministerium der Justiz und für Verbraucherschutz,"18679145,18679145",JMBl
Kom / Kommission der Europäischen Gemeinschaften,02541467,KOM-Dokumente; Dokumente ( Hauptsacht. teils u. später Nebent. ); Com ( Hauptsacht. teils )
Datenschutz-Berater,"01707256,01707256","DSB; Informationsdienst zu den Problemen von Datenschutz und Datensicherung; DSB, Informationsdienst der Verlagsgruppe Handelsblatt"
"Das Recht der Wirtschaft, Schriftenreihe Das Recht der Wirtschaft",01700421,RdW
"Entscheidungen der Finanzgerichte, Sammlung der EFG-Mitteilungen","01755390,01755390",Entscheidungen der Finanzgerichte / Sammlung der EFG-Mitteilungen; EFG; Sammlung der EFG-Mitteilungen
BRAK-Mitteilungen,07226934,Mediation & Recht; Meditation und Recht; Mitteilungen
Deutsche Juristenzeitung,"18661696,18661696",Der junge Jurist; Spruchpraxis; DJZ; Deutsche Juristenzeitung; Sondernr.; Festnr. ( Zusatz einzelner Hefte )
"Polizeiliche Kriminalstatistik des Landes Rheinland-Pfalz, [Jahresbericht]",09329595,
Handbuch zur Umsatzsteuerveranlagung,04189981,Handbuch zur Umsatzsteuer-Mehrwertsteuer; Schriften des Deutschen Wissenschaftlichen Steuerinstituts der Steuerbevollmächtigten / Handbuch zur Umsatzsteuerveranlagung; Handbuch zur USt-Mehrwertsteuer ( Hauptsacht. 1968 ); USt. 1963/64-1976 ( Nebent. ); USt-Mehrwertsteuer ( 1968 )
Beiträge zur Landeskunde,04088492,aus dem Arbeitsgebiet der Abteilung Landeskunde des Statistischen Landesamts für Württemberg-Hohenzollern ( Zusatz bis 8.1952 )
"Schulverwaltung, Nordrhein-Westfalen","09377239,09377239",Zeitschrift für Schulleitung und Schulaufsicht; Zeitschrift für Schulentwicklung und Schulmanagement; SchVw NRW; Schulverwaltung / Ausgabe Nordrhein-Westfalen ( Hauptsacht. bis 17.2006 ); Zeitschrift für Schulleitung und Schulaufsicht ( Zusatz anfangs )
"Deutsche Polizei, Ausgabe Bremen","0170642X,0170642X",Deutsche Polizei <Hilden> / Ausgabe Bremen
Personal im öffentlichen Dienst,07207395,Statistik von Baden-Württemberg / Personal im öffentlichen Dienst; Das Personal im öffentlichen Dienst ( Hauptsacht. 1977 )
"Polizeispiegel, [Rheinland-Pfalz, Saarland]. [Rheinland-Pfalz]","09374876,09374876",Kurier für die Polizei der Länder Rheinland-Pfalz und Saarland; Fachorgan der Deutschen Polizeigewerkschaft im Deutschen Beamtenbund
"Deutsche Polizei, Ausgabe Saarland","01706489,01706489",Deutsche Polizei <Hilden> / Ausgabe Saarland; Deutsche Polizei <Hilden> / Landesbezirk Saarland; Deutsche Polizei <Hilden> / Saarland; Deutsche Polizei <Hilden> / Landesjournal Saarland; Organ der Gewerkschaft der Polizei; Landesbezirk Saarland ( Sachl. Benennung teils ); Saarland ( Sachl. Benennung teils ); Landesjournal Saarland ( Sachl. Benennung teils )
Sicherheit im öffentlichen Dienst,01706985,
Arbeits- und Sozialrecht in Zeitschriften,04027841,
KB-Helfer,03444007,Der Kriegsbeschädigten-Helfer; Der KB-Helfer ( Hauptsacht. anfangs )
Steuer und Wirtschaft,"03412954,03412954",StuW; Abhandlungen; Rechtsprechung
BFH-PR,"14313928,14313928",Entscheidungen des Bundesfinanzhofs für die Praxis der Steuerberatung von A-Z ( Zusatz bis [5.]2000 ); Entscheidungen des Bundesfinanzhofs für die Praxis der Steuerberatung ( Zusatz teils )
Zeitschrift für das gesamte Insolvenzrecht,"2366200X,2366200X",ZInsO; Wolters Kluwer Online / Zeitschrift für das gesamte Insolvenzrecht
Medien & Recht,02573822,Medien und Recht; M und R; MUR; M & R ( Zusatz anfangs ); Zeitschrift für das Recht der Medien und Werbung ( 2. Zusatz anfangs )
Fundheft für Zivilrecht,00719927,
Demokratie und Recht,03408590,DuR
Die Steuer-Warte,"01782096,01782096","StW; DSTG; Die neue Steuerwarte; Die neue Steuerwarte ( Hauptsacht. 23.1950,1-3 ); nationalsozialist. Beamtenzeitung ( Zusatz anfangs )"
Eastlex,17290732,Fachzeitschrift für Mittel- und Osteuroparecht ( Zusatz teils ); Fachzeitschrift für Osteuroparecht ( Zusatz teils )
Finanz-Rundschau Ertragsteuerrecht,"21944156,21944156",FR; FINR ( Datenbank-Kurzbezeichnung ); Finanz-Rundschau für Einkommensteuer mit Körperschaftsteuer und Gewerbesteuer ( Hauptsacht. 73.1991 - 75.1993 )
"Der Betrieb, Beilage","01719181,01719181","Der Betrieb / Beilage; DB; Die einkommensteuerliche Behandlung der Renten; Der Betrieb / Spezial; DB; Wochenschrift für Betriebswirtschaft, Steuerrecht, Wirtschaftsrecht, Arbeitsrecht; Spezial ( Zusatz einzelner Hefte ); Spezial Buchmarkt ( Zusatz einzelner Hefte )"
Zeitschrift für Arbeitsrecht,"0342328X,0342328X",ZFA
Amtsblatt der Evangelischen Landeskirche in Württemberg,00143529,
Kritische Justiz,"29423295,29423295",KJ; Vierteljahresschrift ( Zusatz bis 36.2003 )
Zeitschrift für Tarifrecht,09318577,"ZTR; Zeitschrift für Tarif-, Arbeits- und Sozialrecht des öffentlichen Dienstes ( Nebent. bis 1995 )"
Architektenhandbuch,"01734326,01734326",
"Schulverwaltung, Hessen, Rheinland-Pfalz","18652026,18652026","Schulverwaltung / Ausgabe Hessen; Schulverwaltung / Ausgabe Hessen und Rheinland-Pfalz; Schulverwaltung / Ausgabe Hessen, Rheinland-Pfalz und Saarland; SchVw HE/RP; Zeitschrift für Schulleitung und Schulaufsicht; Zeitschrift für Schulentwicklung und Schulmanagement; Ausgabe Hessen ( Sachl. Benennung bis 5.2001 ); Ausgabe Hessen, Rheinland-Pfalz und Saarland ( Sachl. Benennung 6.2002 - 9/10.2005 ); Ausgabe Hessen und Rheinland-Pfalz ( Sachl. Benennung 11.2006 ); SchVw He ( Nebent. bis 5.2001 ); Schulverwaltung HRS ( Nebent. 6.2002 - 9/10.2005 )"
Versicherung und Recht kompakt,"18619843,18619843",VK; Aktueller Informationsdienst für die Schadensbearbeitung
Tierbefreiung,"14380676,14380676",
Monatsschrift für Kriminologie und Strafrechtsreform,"23661968,23661968",MSchrKrim; MSchKrim
Verkehrsrechtliche Mitteilungen,03426734,
Juristische Zeitung für das Königreich Hannover,"23654511,23654511",Juristische Zeitung für Hannover ( Hauptsacht. teils )
"Deutsche Polizei, [Bundesausgabe] : einheitl. Ausg",09492844,Gesetzessammlung; Das Magazin der Gewerkschaft der Polizei; Organ der Gewerkschaft der Polizei ( Zusatz anfangs ); Zeitschrift der Gewerkschaft der Polizei ( Zusatz früher )
Deutscher Reichsanzeiger und Preußischer Staatsanzeiger,"26283646,26283646","Kraftloserklärung von Wertpapieren; Deutscher Reichs-Anzeiger und Königlich Preußischer Staats-Anzeiger ( Hauptsacht. bis 1918,9.Nov. )"
"Der raisonirende Juriste, welcher seine Raisonements aus denen Reguln der Klugheit, und dem vernünfftigen Rechte, wie auch denen römischen und teutschen Antiquitäten über die Stücke der Rechts-Gelehrsamkeit ergehen lässet","25095285,25095285","Der raisonnierende Juriste, welcher seine Raisonnements aus denen Regeln der Klugheit und dem vernünftigen Rechte, wie auch denen römischen und teutschen Antiquitäten über die Stücke der Rechtsgelehrsamkeit ergehen lässet; Der raisonnirende Juriste, welcher seine Raisonnements aus denen Regeln der Klugheit und dem vernünfftigen Rechte, wie auch denen Römischen und Teutschen Antiquitäten über die Stücke der Rechtsgelehrsamkeit ergehen lässet; Der raisonnirende Juriste, welcher seine Raisonnements aus denen Regeln der Klugheit und dem vernünfftigen Rechte, wie auch denen Römischen und Teutschen Antiquitäten über die Stücke der Rechtsgelehrsamkeit ergehen lässet ( Zitiertitel nach Kirchner )"
"Fachserie / Statistisches Bundesamt, Wiesbaden, 10. Reihe 1: Rechtspflege. Ausgewählte Zahlen für die Rechtspflege","07224834,07224834",Rechtspflege; Ausgewählte Zahlen für die Rechtspflege
Kriminalistik,"00234699,00234699",Kriminalistik-Dokumentation; Kriminalistik-Skript; Zeitschrift für die gesamte kriminalistische Wissenschaft und Praxis ( Zusatz anfangs ); unabhängige Zeitschrift für die gesamte kriminalistische Wissenschaft und Praxis ( Zusatz früher )
Darmstädter Zeitung,"23650079,23650079",150 Jahre hessische Regierungszeitung; Hundertfünfzig Jahre hessische Regierungszeitung; amtliches Organ der Großherzoglichen Hessischen Staatsregierung ( Zusatz anfangs )
Zeitschrift für Unternehmens- und Gesellschaftsrecht,03402479,ZGR; Bibliographie zum Gesellschaftsrecht
Annalen der preußischen innern Staats-Verwaltung,"21926476,21926476",
Gesetze und Verfassungen im Justizfach für Österreich,27880818,Gesetze und Verordnungen im Justizfache; Josephs des Zweyten römischen Kaisers Franz Gesetze und Verfassungen im Justizfache; Seiner Majestät des Kaisers Franz Gesetze und Verfassungen im Justiz-Fache; Gesetze und Verfassungen im Justizfache ( Hauptsacht. anfangs )
Jura,"01701452,01701452",Juristische Ausbildung; Aktuelle Rechtsprechung in der Jura-Kartei (JK); JK; Jura Info
"Gesetzblatt der Deutschen Demokratischen Republik, Teil 2",01381695,Gesetzblatt der DDR
Die Bundes-Polizei,"14393662,14393662","Bundespolizei ( Hauptsacht. teils ); Gewerkschaft der Bundespolizei ( Hauptsacht. 44.1995,1-2u.5 ); offizielles Organ des Bundesgrenzschutz-Verbandes (bgv) ( Zusatz anfangs )"
Zeitschrift für die gesamte Strafrechtswissenschaft,"00845310,00845310",ZStW; Auslandsrundschau; ZStW ( Zusatz anfangs )
Juridikum,10195394,Zeitschrift im Rechtsstaat
Steuer-Journal.de,"16132882,16132882",SJ
Arbeitshefte / Arbeitsgemeinschaft der Parlaments- und Behördenbibliotheken,05182220,Materialien / Arbeitshefte - Arbeitsgemeinschaft der Parlaments- und Behördenbibliotheken; APBB-Arbeitshefte
Causa Sport,16608399,Die Sport-Zeitschrift für nationales und internationales Recht sowie für Wirtschaft; Cau§a; §port; CaS; die Sport-Zeitschrift für nationales und internationales Recht sowie für Wirtschaft; interdisziplinäre Zeitschrift für nationales und internationales Sportrecht
"Recht, Justiz, Zeitgeschehen","09330399,09330399","RJZ; Legal affairs, justice, contemporary events ( Haupttitel teils )"
Außenwirtschaftliche Praxis,09473017,AW-Prax; Newsticker; AW-Prax / Newsticker
Handbuch zur Körperschaftsteuerveranlagung,01712357,Schriften des Deutschen Wissenschaftlichen Steuerinstituts der Steuerbevollmächtigten; Schriften des Deutschen Wissenschaftlichen Steuerinstituts der Steuerberater und Steuerbevollmächtigten; KSt; Schriften des Deutschen Wissenschaftlichen Instituts der Steuerberater / Handbuch zur Körperschaftsteuerveranlagung
"Polizei-Info, Polizeiforum","01774573,01774573",
Düsseldorf in Zahlen,04181263,"Aus der Düsseldorfer Statistik ( Hauptsacht. 1944,März )"
Neue Justiz,00283231,NJ; Zeitschrift für Anwaltspraxis und Gerichtspraxis; Zeitschrift für Recht und Rechtswissenschaft; Zeitschrift für sozialistisches Recht und Gesetzlichkeit; Zeitschrift für Rechtsentwicklung und Rechtsprechung in den Neuen Ländern; Zeitschrift für Rechtsetzung und Rechtsanwendung; Zeitschrift für Rechtsentwicklung und Rechtsprechung; Zeitschrift für Rechtsentwicklung und Rechtsprechung
Zeitschrift für die gesamte erbrechtliche Praxis,"18624790,18624790",ErbR
Amtsblatt der Stadt Mönchengladbach,09348964,
"Informationen für Auswanderer und Auslandstätige, Leitfaden für Arbeitsverträge bei Auslandstätigkeit",21923639,
Die Bundesverwaltung,"00075930,00075930",
Zeitschrift für Strafvollzug und Straffälligenhilfe,"03423514,03423514",ZfStrVo
"Der Beamtenbund / Bundesleitung des Deutschen Beamtenbundes, Gewerkschaft der Berufsbeamten, Ausgabe Nordrhein-Westfalen",01715704,Der Beamtenbund / Ausgabe Nordrhein-Westfalen
Wirtschaftsdienst Ingenieure & Architekten,"14338300,14338300","WIA; Wirtschaftsdienst für Ingenieure und Architekten ( Hauptsacht. bis 2002,5 ); Honorargestaltung, Planungsleistungen, Musterverträge, Büro-Management, Steuergestaltung ( Zusatz anfangs )"
Entscheidungen des Bundesarbeitsgerichts,"04337050,04337050",BAGE
"Deutsche Polizei, Ausgabe Baden-Württemberg","01706381,01706381",Deutsche Polizei <Hilden> / Ausgabe Baden-Württemberg; Organ der Gewerkschaft der Polizei
"Reichs-Fama, welche das Merckwürdigste von demjenigen, so sich ganz kürzlich auf dem Reichs-Convent, an dem Kayserlichen und anderen Höfen, auch mit denen übrigen Ständen des Heiligen Römischen Reichs zugetragen, besonders das, so in das Jus publicum Germaniae tam universale, quam singulorum statuum einschläget, aufrichtig und in guter Ordnung mittheilet","23654562,23654562","Reichs-Fama, welche das Merckwürdigste von demjenigen, so sich gantz kürtzlich auf dem Reichs-Convent, an dem Kayserlichen und anderen Höfen, auch mit denen übrigen Ständen des Heiligen Römischen Reichs zugetragen ... ( Hauptsacht. teils ); Reichs-Fama, welche das Merckwürdigste von demjenigen, so sich gantz kürtzlich auf dem Reichs-Convent, an dem Kayserlichen und anderen Höfen, auch mit denen übrigen Ständen des H. Römischen Reichs zugetragen ... ( Hauptsacht. teils ); Reichs-Fama, welche fürnemlich das Merckwürdigste von demjenigen, so sich gantz kürtzlich auf dem Reichs-Convent, an dem Kayserlichen und anderen Höfen, auch mit denen übrigen Ständen des Heiligen Römischen Reichs zugetragen ... ( Hauptsacht. teils )"
Zeitschrift für Zivilprozess,"03423468,03423468",ZZP; Zeitschrift für Zivilprozess ( Hauptsacht. teils ); Busch's Zeitschrift ( Nebent. anfangs )
Berliner Anwaltsblatt,"09303065,09303065",Mitteilungsblatt des Berliner Anwaltsvereins e.V. mit den amtl. Bekanntmachungen der Rechtsanwaltskammer Berlin und der Notarkammer Berlin ( Zusatz anfangs )
Zeitschrift für öffentliches Recht,"09484396 (1996),22272410 (19191944),09484396",ZÖR; Austrian journal of public and international law; Journal of public law
Arztrecht,"03435733,03405524,03435733,03405524",Kompendium des gesamten Rechtes der Medizin ( Zusatz anfangs ); offizielles Organ der Arbeitsgemeinschaft für Arztrecht ( 2. Zusatz anfangs )
Europa ethnica,00142492,Zeitschrift für Minderheitenfragen; Zeitschrift für Minderheitenfragen ; mit offiziellen Mitteilungen d. Föderalistischen Union Europäischer Volksgruppen; Vierteljahresschrift für Nationalitätenfragen ( Zusatz anfangs )
Humanitäres Völkerrecht,"09375414,09375414",HuV-I; HuV ( Zusatz anfangs )
Board,"2192211X,2192211X",
Neues Archiv für Handelsrecht,"23665408,23665408",
"Amtsblatt der Bayerischen Staatsministerien für Unterricht und Kultus und Wissenschaft, Forschung und Kunst, Teil 1","14393409,14393409","Amtsblatt der Bayerischen Staatsministerien für Unterricht und Kultus und Wissenschaft, Forschung und Kunst / 1; Amtsblatt des Bayerischen Staatsministeriums für Unterricht und Kultus ( Hauptsacht. 1975,5 - 1986,23 ); Amtsblatt der Bayerischen Staatsministerien für Unterricht und Kultus und Wissenschaft und Kunst ( Hauptsacht. 1986,24 - 1990,19 )"
Juristische Blätter,"00226912,00226912","Systematische Übersicht der in der Zeit vom ... bis ... veröffentlichten Entscheidungen des Obersten Gerichtshofes; JBl; Juristische Blätter vereinigt mit Gerichtszeitung ( Hauptsacht. 61.1932 - 67.1938,5(März) )"
Deutsche Richterzeitung,"03408612,03408612","DRiZ; DRiZ; Organ des Deutschen Richterbundes, Bund der Richterinnen und Richter, Staatsanwältinnen und Staatsanwälte ( Zusatz anfangs )"
Anwaltsblatt,"01717227,01717227",AnwBl
Juridisches Magazin,"18661025,18661025",
Vergabe-Navigator,"18616658,18616658",
Entscheidungen zum Wirtschaftsrecht,01779303,EWiR
Recht der Datenverarbeitung,"01788930,01788930",RDV; Zeitschrift für Praxis und Wissenschaft ( Zusatz anfangs )
Recht der Finanzinstrumente,"21913838,21913838",
Vereinte Nationen,"0042384X,0042384X",
Monatsschrift für deutsches Recht,"03401812,03401812",MdR; MDReport; MD Report; Zeitschrift für die Zivilrechts-Praxis; Zeitschrift für die Zivilrechts-Praxis; inklusive MDRonline
Tijdschrift voor rechtsgeschiedenis,00407585,Revue d'histoire du droit; The legal history review ( Hauptsacht. teils )
Deutsche Steuer-Zeitung,"07245637,07245637","Aufwertungs-Praxis; Goldbilanz-Praxis; Der Lohnabzug; Buch- und Betriebsführung; DStZ; Deutsche Steuerzeitung und Wirtschaftlicher Beobachter ( Hauptsacht. 23.1934,Apr. - 34.1945 )"
Kirche & Recht,"09478094,09478094",Kirche und Recht; KuR
Kleiner Verwaltungsbericht der Stadt Mülheim an der Ruhr,01738887,
Dienststellen- und Telefonverzeichnis / Stadt Wien,00047805,Dienststellen- und Telephonverzeichnis ( Hauptsacht. anfangs ); Dienststellen- und Telefonverzeichnis der Stadt Wien ( Hauptsacht. teils )
Strasburger Anzeiger,09411674,
"Amtsblatt der Europäischen Gemeinschaften, L: Rechtsvorschriften",03769453,Amtsblatt der Europäischen Gemeinschaften / L
Transportrecht,"0174559X,0174559X",TranspR ( Zusatz anfangs )
ÖGZ,10278931,Österreichische Gemeinde-Zeitung; Das Magazin des Österreichischen Städtebundes; offizielle Zeitschrift des Österreichischen Städtebundes; offizielle Zeitschrift des Österr. Städtebundes; ÖGZ - Österreichische Gemeinde-Zeitung; Österreichische Gemeinde-Zeitung ( Haupttitel früher )
Non-profit law yearbook,"26254107,26254107",Non profit law yearbook; Schriftenreihe des Instituts für Stiftungsrecht und das Recht der Non-Profit-Organisationen
Migralex,"00142492,1727057X",
Lebensversicherungsmedizin,00240044,Blätter für den versicherungsärztlichen Dienst
Zentralblatt für Jugendrecht,"01766449,01766449",ZfJ; Organ des Deutschen Instituts für Vormundschaftswesen ( Zusatz anfangs )
Neue Schriften des Deutschen Städtetages,"04189604,04189604",Die neuen Schriften des Deutschen Städtetages ( Hauptsacht. teils )
"Sächsisches Amtsblatt / hrsg. von der Sächsischen Staatskanzlei, Sonderdruck",09469966,Sächsisches Amtsblatt / Sonderdruck
Arbeits- und Sozialrecht,00037664,
Beiträge zur gerichtlichen Medizin,00675016,
"Entscheidungen des Schweizerischen Bundesgerichts, 3: Privatrecht = Droit privé = Diritto privato","01723391,16626958,22358498",Entscheidungen des Schweizerischen Bundesgerichts / 3; Entscheidungen des Schweizerischen Bundesgerichtes ( Hauptsacht. anfangs ); Betreibungs- und Konkursrecht ( Sachl. Benennung bis 117.1992 ); Schuldbetreibungs- und Konkursrecht ( Sachl. Benennung 118.1992 - 120.1994 ); Zivilrecht- und Schuldbetreibungs- und Konkursrecht ( Sachl. Benennung 121.1995 - 137.2011 )
Kritische Jahrbücher für deutsche Rechtswissenschaft,"18661432,18661432",Neue kritische Jahrbücher für deutsche Rechtswissenschaft ( Nebent. 6.1842 - 12.1848 = Bd. 11-24 ); gezählt als 1.1842 - 7.1848 = Bd. 1-14 ( Nebent. 6.1842 - 12.1848 = Bd. 11-24 )
Haufe-Personal-Office Standard,"21903212,21903212",Haufe Personal Office; Haufe Personal Office Standard; Haufe PersonalOffice Standard; Personal-Office Standard; HPO standard
Wege zur Sozialversicherung,"00432059,00432059",WZS; WzS-Archiv
Betriebliche Altersversorgung,00059951,Mitteilungsblatt d. Arbeitsgemeinschaft für Betriebliche Altersversorgung (ABA) ( Zusatz bis 54.1999 )
Gesetzblatt der Deutschen Demokratischen Republik,02325993,Gesetzblatt der DDR
Punkt,"14343991,14343991","das Magazin aus Berlin für den EU-Arbeitsmarkt und die Förderung durch den Europäischen Sozialfonds ( Zusatz bis 16.2007,80 )"
Das Parlament,"00312258,00312258",Das Parlament / Debattendokumentation; Das  Parlament / Leicht erklärt!; die Woche im Bundestag ( Zusatz anfangs )
Verfassungsschutzbericht,01770357,"linksextremist. Bestrebungen, rechtsextremist. Bestrebungen, sicherheitsgefährdende u. extremist. Bestrebungen von Ausländern, Spionageabwehr ( Zusatz anfangs )"
Karlsruher juristische Bibliographie,"04533283,04533283",KJB
Heidelberger Kommentar zum Betreuungs- und Unterbringungsrecht,"09457488,09457488",Betreuungs- und Unterbringungsrecht; HK-BUR
Schwerpunkte des Kartellrechts,"01740210,01740210",
