title,issn,alternativeTitle
"Referate, gehalten in der Mitgliederversammlung des Bundes für Lebensmittelrecht und Lebensmittelkunde e. V",01706039,"Referate, gehalten in der Gründungsversammlung ( Hauptsacht. 1955 ); Referate, gehalten in der Mitgliederversammlung ( teils )"
Der Verkehrsdienst,03414388,VD; Der Verkehrsdienst für den Straßenverkehr ( Nebent. anfangs )
Verwaltungswissenschaftliche Informationen,07225059,
Hochfürstlich-Fürstenbergischer Staats- und Addresse-Kalender,27023303,
Der medizinische Sachverständige,00258490,
"Polizeireport, Mittelhessen : für Mittelhessen mit den Landkreisen Gießen, Lahn-Dill, Marburg-Biedenkopf, Wetteraukreis",09375341,
"Discussion papers / Deutsches Forschungsinstitut für Öffentliche Verwaltung, Speyer","18689728,18689728",FÖV discussion papers
Reach plus,"23666935,23666935",
Amtsblatt für den Regierungsbezirk Detmold,00032298,Öffentlicher Anzeiger zum Amtsblatt für den Regierungsbezirk Detmold
Bericht des Bundeskartellamtes über seine Tätigkeit in den Jahren ... sowie über die Lage und Entwicklung auf seinem Aufgabengebiet und Stellungnahme der Bundesregierung,04337158,Bericht des Bundeskartellamtes über seine Tätigkeit in den Jahren ... sowie über die Lage und Entwicklung auf seinem Aufgabengebiet ( Hauptsacht. anfangs ); Bericht des Bundeskartellamts über seine Tätigkeit in den Jahren ... sowie über die Lage und Entwicklung auf seinem Aufgabengebiet und Stellungnahme der Bundesregierung ( Hauptsacht. 1995/96 ); Tätigkeitsbericht des Bundeskartellamtes ... ( Ab 2011 Nebent. teils )
Kaiserl. Königl. Ober-Oesterreichischer Hof- und Landesstellen-Schematismus,29604168,"Kaiserlich-Königlicher Ober-Österreichischer Hof- und Landesstellen-Schematismus; Kaiserl.-Königl. ober-österreichischer Hof- und Landesstellen-Schematismus, sammt einem Schreibkalender ( Hauptsacht. teils )"
Der Bergsträßer Bote,27007731,
Informationsbrief Ausländerrecht,"01742108,01742108",Ausländerrecht; InfAuslR
Der Städtetag,"00389048,00389048",Aufbau der Städte; Zeitschrift für kommunale  Praxis und Wissenschaft; Organ des Verbandes Kommunaler Fuhrparks- und Stadtreinigungsbetriebe; Mitteilungen des Deutschen Städtetages
"Schleswig-holsteinische Anzeigen, Teil B","18609651,18609651",
"Karriereführer, Recht","16190025,16190025",das Magazin für Hochschulabsolventen; Berufseinstieg für Hochschulabsolventen ( Zusatz anfangs )
Recht der Energiewirtschaft,"0944128X,0944128X",RdE; Energierechts-Praxis
PublicGovernance,"18664431,18664431","Public governance; Fachzeitschrift für Aufsichtsräte aus Politik und Verwaltung ( Zusatz bis 2007,Wi. )"
Der Gerichtssaal,09367438,
Feuerwehr-Jahrbuch ...,"00714674,00714674",Feuerwehr-Jahrbuch; ein Jahresbericht über das Feuerwehrwesen in der Bundesrepublik Deutschland ( Zusatz anfangs )
Der bayerische Bürgermeister,"07237022,07237022","Gemeindewirtschaft und Technik; Zeitschrift für Kommunale Selbstverwaltung; Die bayerische Bürgermeisterin ( Haupttitel 73. (103.) Jahrgang, 2 (2021) )"
Gestaltende Steuerberatung,"0947501X,0947501X","GStB; Sonderausgabe; Rechtsprechungsübersicht + aktuelle Verwaltungsanweisungen + Literaturhinweise; Informationsdienst für Steuerberater, Wirtschaftsprüfer, Rechtsanwälte ( 2. Zusatz anfangs ); Mandantenbetreuung: Beratung, Gestaltung, Modelle ( 3. Zusatz anfangs )"
Der deutsche Rechtspfleger,0341678X,Der Büchertisch; Rpfleger; Zeitschrift für rheinische Justizbeamte ( Hauptsacht. anfangs )
Die Friedens-Warte,"03400255,03400255",Journal of international peace and organization; Mitteilungen der Österreichischen Friedensgesellschaft; Blätter für internationale Verständigung und zwischenstaatliche Organisation; Blätter für zwischenstaatliche Organisation; Wochenschrift für internationale Verständigung; Zeitschrift für internationale Verständigung; Zeitschrift für zwischenstaatliche Organisation
"Höchstrichterliche Finanzrechtsprechung des Bundesfinanzhofs, Bundesverfassungsgerichts, anderer oberster Gerichtshöfe des Bundes, des Gerichtshofs der Europäischen Union","00183059,00183059","Rechtsprechung des Bundesverfassungsgerichts; Sämtliche Entscheidungen des Bundesfinanzhofes; Entscheidungen des Bundesverfassungsgerichts; HFR; Höchstrichterliche Finanzrechtsprechung; Höchstrichterliche Finanzrechtsprechung des Bundesfinanzhofs, Bundesverfassungsgerichts, anderer oberster Gerichtshöfe des Bundes, des Gerichtshofs der Europäischen Gemeinschaften ( Nebent.  früher )"
Recht und Schaden,"03439771,03439771",R + S; R und S; monatliche Informationsschrift für Schadenversicherung und Schadenersatz; unabhängige monatliche Informationsschrift für Versicherungsrecht und Schadenersatz; unabhängige Zeitschrift für Versicherungsrecht und Schadenersatz
"Bundesgesetzblatt, Teil 1","21941998,21941998",Bundesgesetzblatt / 1
IP kompakt,"18645720,18645720",Informationsdienst intellectual property; IPkompakt
Agrarrecht,"0340840X,0340840X",Frühjahrstagung der Deutschen Gesellschaft für Agrarrecht; Wintertagung der Deutschen Gesellschaft für Agrarrecht; AgrarR
Fürsorgerechtliche Entscheidungen der Verwaltungs- und Sozialgerichte,"03408965,09453253",FEVS; Fürsorgerechtliche Entscheidungen
Innovative Verwaltung,"16189876,16189876",Vier; Das Fachmedium für erfolgreiches Verwaltungsmanagement; IV; IV; Zeitschrift für die Reformpraxis der öffentlichen Verwaltung; die Fachzeitschrift für erfolgreiches Verwaltungsmanagement; Die innovative Verwaltung ( Hauptsacht. bis 1997 )
Kirchliches Amtsblatt für die Erzdiözese Paderborn,"2510893X,2510893X",
Familienrecht kompakt,"16178173,16178173","FK; FK ( Nebent. ab 2011,9 )"
"Schleswig-holsteinische Anzeigen, Teil A","18609643,18609643",Schleswig-holsteinische Anzeigen / A; Liste der weitergeltenden Verwaltungsvorschriften; Bereinigung von veröffentlichten Justizverwaltungsvorschriften; Justizministerialblatt für Schleswig-Holstein; SchlHA
"Teutsche Staatskanzlei, Deductions- und Urkundensammlung : ein Beitrag zur Teutschen Staatskanzlei","21930694,21930694",Deutsche Staatskanzlei; Deduktions- und Urkundensammlung
Bürgerrechte & Polizei,09325409,Civil liberties and police / Bürgerrechte & Polizei; CILIP; Bürgerrechte und Polizei; Informationsdienst: Bürgerrechte und Polizei ( Hauptsacht. 8.1981 - 9/10.1981 ); Bürgerrechte und Polizei ( Hauptsacht. teils )
Zeitschrift für neues Energierecht,14343339,ZNER
GmbH-Geschäftsführer aktuell,"21951969,21951969",Schutz und Sicherheit für Sie als Geschäftsführer und Ihre GmbH
Kritische Vierteljahresschrift für Gesetzgebung und Rechtswissenschaft,"23646071,23646071",KritV; Kritische Vierteljahrsschrift für Gesetzgebung und Rechtswissenschaft ( Hauptsacht. 1.1859 - N.F. 1=20.1878 )
BGH-Report,"16169743,16169743",
Dr. J. A. Seuffert's Blätter für Rechtsanwendung,"18660746,18660746",Seuffert's Blätter für Rechtsanwendung; J. A. Seuffert's Blätter für Rechtsanwendung; Doktor J. A. Seuffert's Blätter für Rechtsanwendung; Doktor J. A. Seuffert's Blätter für Rechtsanwendung zunächst in Bayern ( Hauptsacht. bis N.F. 42=62.1897 ); Blätter für Rechtsanwendung zunächst in Bayern ( Auf d. Bd.-Titelbl. N.F. 4=24.1859 - 42=62.1897 ); Blätter für Rechtsanwendung ( Hauptsacht. 63.1898 - 71.1906 )
Recht & Psychiatrie,"07242247,07242247",R & P; Recht und Psychiatrie
Blätter für Rechtsanwendung,"18660754,18660754",
Informaciones / Deutsch-Spanische Juristenvereinigung e.V,09371141,INF; Revista jurídica hispano-alemana
Zeitschrift für Personalvertretungsrecht,09349677,ZfPR
Zentralblatt für die gesamte Unterrichtsverwaltung in Preußen,26999846,"Centralblatt für die gesammte Unterrichts-Verwaltung in Preußen ( Hauptsacht. bis 1899,4 ); Centralblatt für die gesamte Unterrichts-Verwaltung in Preußen ( 1899,5 - 1902 )"
OLG-Report Düsseldorf,09402144,Report
Zeitschrift für die Steuer- und Erbrechtspraxis,"14393182,14393182",ZErb
Lohnsteuer-Handausgabe,"09447733,09447733",
"Verfügungen und Mitteilungen des Ministeriums für Bildung, Teil 1: Allgemeinbildende Schulen und Einrichtungen für Kinder",03233286,"Verfügungen und Mitteilungen des Ministeriums für Bildung und Wissenschaft ( Hauptsacht. 1990,4-9 )"
Archiv für bürgerliches Recht,"01748467,01748467",
Teutsche Staatskanzlei,"21926514,21926514",Deutsche Staatskanzlei; Teutsche Staatskanzley ( Hauptsacht. bis 39.1800 )
"Jahrbuch für Gesetzgebung, Verwaltung und Rechtspflege des Deutschen Reiches",1619649X,"Jahrbuch für Gesetzgebung, Verwaltung und Rechtspflege; Jahrbuch für Gesetzgebung, Verwaltung und Rechtspflege des Deutschen Reichs ( Hauptsacht. teils )"
Entscheidungen des Bundesverwaltungsgerichts,"00139106,00139106",BVerwGE
"Zeitschrift der Savigny-Stiftung für Rechtsgeschichte, Kanonistische Abteilung","03234142,03234142",Zeitschrift der Savigny-Stiftung für Rechtsgeschichte / Kanonistische Abteilung; ZRG KA; Zeitschrift für Rechtsgeschichte / Kanonistische Abteilung; ZRG KA; Zeitschrift für Rechtsgeschichte
"Media-Perspektiven, Dokumentation",01777270,Media-Perspektiven / Dokumentation
Europa kommunal,"14337428,14337428",
Zeitschrift für das gesamte Lebensmittelrecht,03423476,ZLR
Bundesarbeitsblatt,"00075868,00075868",Arbeitsschutz ( 1.Zusatz anfangs ); Bundesversorgungsblatt ( 2.Zusatz anfangs ); Arbeits- und Sozialstatistik ( 3.Zusatz anfangs )
"Der Steuerzahler, [Ausgabe Bayern]","0170687X,0170687X",Der Steuerzahler <Wiesbaden> / Ausgabe Bayern; Monatszeitschrift des Bundes der Steuerzahler
Gutachten zum internationalen und ausländischen Privatrecht,"03407381,03407381",IPG ( Nebent. ab 1999 )
Juristische Arbeitsblätter,"07206356,00226904,07206356,00226904",JA; Sonderheft für Erstsemester; JA; Zeitschrift für Studenten und Referendare; Juristische Arbeitsblätter für Ausbildung und Examen ( Nebent. anfangs )
Das Grundeigentum,"00174882,00174882",RDM kompakt; Haus & Grund intern; Haus und Grund intern; Sachverständige Spezial; Organ des Bundes der Berliner Haus- und Grundbesitzervereine e.V. und des Berliner Landesverbandes der Immobilienberufe und Hausverwalter e.V. im Ring Deutscher Makler ( 2. Zusatz anfangs )
Forum Kriminalprävention,16184912,
Mitteilungen der deutschen Patentanwälte,00266884,
Zeitschrift für Kommunalfinanzen,"01741136,01741136",ZKF
"Zeitschrift der Savigny-Stiftung für Rechtsgeschichte, Romanistische Abteilung",23044934,Zeitschrift der Savigny-Stiftung für Rechtsgeschichte / Romanistische Abteilung
Verwaltungsrundschau,03425592,VR
Fundstellennachweis des geltenden Gemeinschaftsrechts,16084535,Amtsblatt der Europäischen Union / Fundstellennachweis des geltenden Gemeinschaftsrechts; Amtsblatt der Europäischen Gemeinschaften / Fundstellennachweis des geltenden Gemeinschaftsrechts
MEZIS-Nachrichten,21941440,
"Wertpapier-Mitteilungen, Teil 4: Zeitschrift für Wirtschafts- und Bankrecht. Sonderbeilage","09459715,09459715",WM; Zeitschrift für Wirtschafts- und Bankrecht; Sonderbeilagen ( Sachl. Benennung d. 3.OG teils )
ArbeitGeberRechte Betriebsrat aktuell,"2364026X,2364026X",schnelle Hilfe Arbeitgeberrechte aktuell
"Staatshandbuch, Rheinland-Pfalz : Handbuch der Landes- und Kommunalverwaltung mit Aufgabenbeschreibungen und Adressen","18615023,18615023",Staatshandbuch / Rheinland-Pfalz; Handbuch der Landes- und Kommunalverwaltung mit Aufgabenbeschreibungen und Adressen; Staatshandbuch die Bundesrepublik Deutschland
Verwaltungsarchiv,"00424501,00424501","VerwArch; Zeitschrift für Verwaltungslehre, Verwaltungsrecht und Verwaltungspolitik; VerwArch"
Zeitschrift für das Fürsorgewesen,03423379,ZfF
Rechtspflegerblatt,00341363,Rechtspflegertag
Zeitschrift für Lebensrecht,"09444521,09444521",ZfL
Kirchliches Amtsblatt der Evangelisch-Lutherischen Landeskirche Mecklenburgs,"02324172,02324172",Kirchliches Amtsblatt für die Evangelisch-Lutherische Landeskirche Mecklenburgs
Juristische Rundschau,"16127064,16127064",
NZI: neue Zeitschrift für Insolvenz- und Sanierungsrecht,"14364778,14364778",Neue Zeitschrift für Insolvenz- und Sanierungsrecht; NZI Insolvenzrecht; Neue Zeitschrift für Insolvenzrecht; neue Zeitschrift für das Recht der Insolvenz und Sanierung; Neue Zeitschrift für das Recht der Insolvenz und Sanierung ( Hauptsacht. bis 17.2014 ); das gesamte Verfahren der Unternehmens- und Verbraucherinsolvenz ( Zusatz bis 17.2014 )
Wirtschaft und Statistik,"00436143,00436143",Struktur der Wanderungen über Auslandsgrenzen des Bundesgebietes; Statistische Monatszahlen; WISTA
Die Polizei,00323519,"Die Familie; Der Diensthund; Der Polizeihund; Führer der Polizeiexekutive; Erste Beamtenvertretertagung der Polizei des Landes Niedersachsen; Mitteilungen der Polizeibeamtenvertretung des Landes Niedersachsen; Mitteilungen der Polizeibeamtenvertretung, Land Niedersachsen; Zeitschrift für das gesamte Polizeiwesen ( Zusatz anfangs ); Zentralorgan für d. Sicherheits-und Ordnungswesen, Polizeiwissenschaft, -recht, -praxis ( Zusatz früher )"
Wohnungswirtschaft und Mietrecht,"01731564,05090717",WM; W&M; Wohnungswirtschaft & Mietrecht; WuM; Wohnungswirtschaft und Mietrecht; Informationsdienst des Deutschen Mieterbundes e.V. ( Zusatz früher )
Sammlung von Entscheidungen aus dem Sozialrecht,03422003,
Deutsche Gerichtsvollzieher-Zeitung,18616593,"DGVB-Nachrichten; Zeitschrift für Vollstreckungs-, Zustellungs- und Kostenrecht; DGVZ; Zeitschrift für Vollstreckungs-, Zustellungs- und Kostenwesen ( Zusatz anfangs ); Sonderausg. ( Zusatz einzelner Hefte )"
Zeitschrift für deutsches und internationales Bau- und Vergaberecht,"01700413,01700413",Übersicht über die Rechtsprechung des Bundesgerichtshofes in Bausachen; Sonderausgabe; offizielles Organ der Deutschen Gesellschaft für Baurecht e.V. und des Instituts für Deutsches und Internationales Baurecht e.V. ( Zusatz anfangs )
Rechtshistorische Reihe,0344290X,
Versicherungswissenschaft in Berlin,"09439609,09439609",Berliner Reihe; Schriftenreihe des Vereins zur Förderung der Versicherungswissenschaft in Berlin e.V.
Wirtschaftsprüfer-Handbuch,"01727079,01727079",WP-Handbuch
Sicherheitsingenieur,"03003329,03003329","Forum Persönliche Schutzausrüstung; Persönliche Schutzausrüstung; Forum persönliche und technische Schutzausrüstungen; Persönliche und technische Schutzausrüstungen; unabhängige Fachzeitschrift zu Sicherheit und Gesundheitsschutz bei der Arbeit ; mit Beiträgen zum Umweltschutz ( Zusatz bis 29.1998 ); unabhängige Fachzeitschrift zu Sicherheit und Gesundheit bei der Arbeit ; mit Beiträgen zum Umweltschutz ( Zusatz bis 37.2006,10 )"
Veröffentlichungen zum Verfahrensrecht,"07227574,07227574",VVerfR
Betriebs-Berater,"03407918,03407918","Betriebsberater; BB; Betriebs-Berater / Sonderveröffentlichung; Domainrecht aktuell; Betriebs-Berater / Jubiläumsmagazin; Betriebs-Berater / Beilage; Organisations-Berater; Banken & Versicherungen; Banken und Versicherungen; Leasing-Berater; Pflicht zur Führung von Karteien, Listen, Verzeichnissen und Büchern im Betrieb; Leasing; Rechtsprechung zum Firmenrecht; Die zweckmäßige Kapitalanlage; Rechtsprechung zum Recht der Außenwerbung; Prozeßkostenrisiko-Tabelle; Die Weihnachtsgratifikation; Auslandsreisen; Zeitschrift für Recht, Steuern und Wirtschaft; Prozeßkostenrisiko-Tabelle; Recht, Wirtschaft, Steuern; Zeitschrift für Recht, Steuern und Wirtschaft; Der Betriebs-Berater ( Hauptsacht. anfangs )"
Bereinigte amtliche Sammlung der Schulvorschriften des Landes Nordrhein-Westfalen,09389288,BASS; Bereinigte amtliche Sammlung der Schulvorschriften ( Nebent. ab 12.1997/98 )
"Bundesgesetzblatt, Teil II","03411109,03411109",Bundesgesetzblatt / 2; Anlageband
"Bundessteuerblatt, Teil 2: Entscheidungen des Bundesfinanzhofs",01755366,Bundessteuerblatt / 2; Bundessteuerblatt / A; Bundessteuerblatt / D
Rheinische Notar-Zeitschrift,"18674186,18674186",RNotZ
Schweizerische Juristen-Zeitung,00367613,SJZ; Publikationsorgan des Schweizerischen Anwaltsverbandes; RSJ
Juristische Rundschau,"00226920,00226920","Von A bis Z aus Gesetzgebung, Rechtsprechung und Rechtswissenschaft; Von A - Z aus Gesetzgebung, Rechtsprechung und Rechtswissenschaft; Mitteilungen aus der Berliner Justiz und Rechtsanwaltschaft; JR"
Strafverteidiger,"07201605,07201605",StV
Steuer-Telex,01707620,StX
Zeitschrift für ausländisches öffentliches Recht und Völkerrecht,"00442348,00442348",ZaöRV; HJIL
Monatsschrift für Kriminalpsychologie und Strafrechtsreform,"29426049,29426049",MSchKrim
Kritische Justiz,"00234834,00234834",KJ; Vierteljahresschrift ( Zusatz bis 36.2003 )
"Wertpapier-Mitteilungen, Teil 4: Zeitschrift für Wirtschafts- und Bankrecht",03426971,"Wertpapier-Mitteilungen / 4; Zeitschrift für Wirtschafts- und Bankrecht; WM / 4; WM; Wertpapier- und Bankfragen, Rechtsprechung ( Sachl. Benennung bis 23.1969 ); T. 4B ( Sachl. Benennung 23.1969 - 14.1960 ); Wirtschafts-, Wertpapier- und Bankrecht ( 24.1970 - 30.1976 )"
Neue Zeitschrift für Wehrrecht,00283525,NZWehrr
Wirtschaft und Wettbewerb,00436151,"Competition and trade regulation; Concurrence et marché; WuW; Zeitschrift für deutsches und europäisches Wettbewerbsrecht; Zeitschrift für Kartellrecht, Wettbewerbsrecht und Marktorganisation; Competition and trade regulation ( Engl. Parallelsacht. bis 47.1997 ); Concurrence et marché ( Franz. Parallelsacht. bis 47.1997 ); Journal of German and European competition law ( Nebent. 48.1998-Jahrgang 65, 2015, Heft 12 (Dezember 2015) ); Journal du droit allemand et européen de la concurrence ( Nebent. 48.1998-Jahrgang 65, 2015, Heft 12 (Dezember 2015) )"
Europarecht,"05312485,05312485",Europarecht <Baden-Baden>; EUR
Recht der internationalen Wirtschaft,"03407926,03407926",RIW; Organisations-Berater; Finanz-Berater; Leasing-Berater; Versicherungs-Berater; Leasing; Versicherung; Kapitalanlage; Betriebs-Berater international; Leasing- und Finanz-Berater; Banken & Versicherungen; Banken und Versicherungen; Computer-Praxis & -Recht; EU-Erweiterungs-Report; RIW-Beihefter
"Bundesgesetzblatt, Teil I","03411095,03411095",Bundesgesetzblatt / 1
Goltdammer's Archiv für Strafrecht,"00171956,00171956",GA; Archiv für Strafrecht; GA
Familie und Recht,"09372180,09372180","FuR; Zeitschrift für die anwaltliche und gerichtliche Praxis ( 2. Zusatz bis 17.2006,3 )"
Wettbewerb in Recht und Praxis,14353059,WRP
Die Stiftung,"18644309,18644309",Magazin Die Stiftung; Magazin ( 1. Zusatz anfangs ); Zeitschrift für das Stiftungswesen und Private Wealth ( 2. Zusatz anfangs ); Magazin für das Stiftungswesen und Private Wealth ( Zusatz anfangs )
Amtsblatt der Stadt Köln,01722522,
Der Kriminalist,"07223501,07223501",
Deutsche Landesreferate zum ... Internationalen Kongreß für Rechtsvergleichung,"03407411,03407411",
Zeitschrift für Binnenschiffahrt und Wasserstraßen,01757091,Sammlung der Rechtsprechung zum Schiffahrtsrecht und sonstige Veröffentlichungen über Rechtsfragen
Deutsche Rechts-Zeitschrift,03406911,Rechtsprechungs-Rundschau
Zeitschrift für ausländisches und internationales Privatrecht,"0932321X,0932321X",Rabels Zeitschrift; Rabels Zeitschrift für ausländisches und internationales Privatrecht ( Nebent. teils )
Schmittiana,09459960,
Anwaltsgebühren spezial,"0942590X,0942590X",AGS; Anwaltsgebühren-spezial; Anwaltsgebühren spezial mit RVGreport; Zeitschrift für das gesamte Gebührenrecht und Anwaltsmanagement
"Verwaltungsführung, Organisation, Personal","01707140,09469028","VOP; Verwaltungsführung, Organisation, Personalwesen. 1982-1993 ( Auf d. Jahresinhaltsverz. )"
BEK-Brücke,00058238,Brücke
Statistische Mitteilungen über das höhere Unterrichtswesen in Preußen,26999919,Statistische Mitteilungen über das höhere Unterrichtswesen in Königreich Preußen; Statistische Mittheilungen über das höhere Unterrichtswesen im Königreich Preußen ( Hauptsacht. bis 18.1901 ); Statistische Mitteilungen über das höhere Unterrichtswesen im Königreich Preußen ( Hauptsacht. 19.1902 - 33.1916 )
Öffentliche Verwaltung und Datenverarbeitung,03429407,ÖVD
Zeitschrift für Rechtssoziologie,"01740202,01740202",
Industriemeister-Nachrichten,"00199303,00199303",
Österreichische Zeitschrift für Wirtschaftsrecht,03794407,ÖZW
Amtsblatt der Europäischen Gemeinschaften,03785009,
"Jahresfachkatalog ... Recht, Sozialwissenschaften, Wirtschaft, Steuern",00752886,"Recht, Sozialwissenschaften, Wirtschaft, Steuern; Jahresfachkatalog Recht, Wirtschaft, Steuern; Recht, Wirtschaft, Steuern; Jahresfachkatalog"
Entscheidungen in Kirchensachen seit 1946,03408760,Sonderband Europäische Entscheidungen; KirchE; Entscheidungen in Kirchensachen
Zeitschrift für Genozidforschung,"14388332,14388332",
GmbHRundschau,"23661062,23661062",GmbHR; GmbH-Rundschau ( Haupttitel früher )
"Fachserie / Statistisches Bundesamt, Wiesbaden, 14. Reihe 9. 5: Finanzen und Steuern. Verbrauchsteuern. Schaumweinsteuer","09438181,09438181",
Blatt für Sortenwesen,"03004627,03004627",Amtsblatt des Bundessortenamtes; Sonderheft Sortenregister
Bundeszollblatt,04315545,
Asylmagazin,"16137450,16137450","ZDWF-Informationsdienst ( Hauptsacht. 1996,1 )"
Schriften zum internationalen und zum öffentlichen Recht,0943173X,
Jahresbericht ... / Amnesty International,"01737759,01737759",
Zeitschrift für die gesamte Strafrechtswissenschaft,"1612703X,1612703X",ZStW; Auslandsrundschau
Lernfeld Betrieb,09304460,"LB ( Nebent. 1992 - 1993,2 ); Bildung + Betrieb ( Hauptsacht. 1.1986,Apr. )"
WIK,1615455X,"Zeitschrift für Wirtschaft, Kriminalität und Sicherheit ( Zusatz anfangs )"
Gochsheimer Nachrichten,"18658296,18658296",Die Gemeindezeitung
Genealogisches Staats-Handbuch,27007316,Genealogisches und Staats-Handbuch ( Hauptsacht. 65.1827 )
Renopraxis,"16117727,16117727",
Sammlung der neuesten Staats-Angelegenheiten vornemlich des Deutschen Reichs,"23671254,23671254",
Rheinisch-westfälischer Jäger,01710796,MesseSpezial; Mitteilungsblatt des Landesjagdverbandes Nordrhein-Westfalen ( Zusatz anfangs )
Archiv für Theorie und Praxis des allgemeinen deutschen Handels- und Wechselrechts,"16122828,16122828",
BKK-Service,"2192788X,07222351,0940788X,2192788X,07222351,0940788X,14361612",Service ( Hauptsacht. teils ); BKK-Betriebs-Service ( Nebent. ab 1997 ); Zeitschrift f. d. Praxis d. Personalsachbearbeitung ( Zusatz anfangs )
Strafverteidiger,"23662166,23662166",
"Berater-Magazin, Office","21943583,21943583","Betriebs-Berater / Office-Management; Software_372office für Recht und Steuern; BB-Reihe Office-Management; Datenbanken, Software, digitale Angebote aus den Bereichen Recht, Wirtschaft und Steuern für alle betrieblichen Berater; Datenbanken, Software und digitale Angebote aus den Bereichen Recht, Wirtschaft und Steuern; Betriebs-Berater. Office-Management ( Haupttitel 2012 )"
Hitzig's Annalen der deutschen und ausländischen Criminal-Rechtspflege,"23668342,23668342",Julius Eduard Hitzig's Annalen der deutschen und ausländischen Criminalrechtspflege; Annalen der deutschen und ausländischen Criminalrechtsprechung; Annalen der deutschen und ausländischen Criminal-Rechtspflege; Annalen der deutschen und ausländischen Criminalrechtsprechung ( Zitiert. nach Kirchner )
Journal für Rechtspolitik,"1613754X,1613754X",JRP
"Sozialwissenschaftlicher Fachinformationsdienst, Organisations- und Verwaltungsforschung","09386041,09386041",SoFid
Zeitschrift für Völkerrecht,09314415,"Zeitschrift für Völkerrecht und Bundesstaatsrecht ( Hauptsacht. bis 7.1913,1 )"
"Forensische psychiatrie, psychologie, kriminologie",18627080,Forens psychiatr psychol kriminol
Zeitschrift für Arbeitsrecht,"23662042,23662042",ZFA
Der Europäische Gemeindetag,03441970,
Datenschutz und Datensicherheit,"16140702,16140702",DuD
Kritische Zeitschrift für Rechtswissenschaft,16119002,
"Johann Friedrich Juglers Beyträge zur juristischen Biographie oder genauere litterarische und critische Nachrichten von dem Leben und den Schriften verstorbener Rechtsgelehrten auch Staatsmänner, welche sich in Europa berühmt gemacht haben","23666595,23666595","Beyträge zur juristischen Biographie oder genauere litterarische und critische Nachrichten von dem Leben und den Schriften verstorbener Rechtsgelehrten auch Staatsmänner, welche sich in Europa berühmt gemacht haben; Juglers Beyträge zur juristischen Biographie oder genauere litterarische und critische Nachrichten von dem Leben und den Schriften verstorbener Rechtsgelehrten auch Staatsmänner, welche sich in Europa berühmt gemacht haben; Beiträge zur juristischen Biographie oder genauere litterarische und critische Nachrichten von dem Leben und den Schriften verstorbener Rechtsgelehrten auch Staatsmänner, welche sich in Europa berühmt gemacht haben"
Verwaltungsarchiv,"23661992,23661992","VerwArch; Zeitschrift für Verwaltungslehre, Verwaltungsrecht und Verwaltungspolitik; VerwArch"
RVG professionell,"16136470,16136470",RVG prof; Informationsdienst für die Rechtsanwaltskanzlei
Zeitschrift für Schadensrecht,01730568,ZfS; Versicherungsrecht
Teilzeitkräfte & Aushilfen aktuell,"16115112,16115112",Teilzeitkräfte und Aushilfen aktuell
Archiv für Theorie und Praxis des allgemeinen deutschen Handelsrechts,"16122828,16122828",Archiv für deutsches Handelsrecht ( Nebent. anfangs )
Kurzprotokoll der ... Sitzung des Vermittlungsausschusses des Deutschen Bundestages und des Bundesrates,0176750X,"Kurzprotokoll der ... Sitzung des Vermittlungsausschusses des Deutschen Bundestages und des Deutschen Bundesrates ( Hauptsacht. Wahlper. 1.1949/53,Sitz.1-15 ); Protokolle des Vermittlungsausschusses des Deutschen Bundestages und des Bundesrates ( Hauptsacht. d. Mikrofiche-Ausg. ); Kurzprotokolle ( Nebent. d. Mikrofiche-Ausg. )"
Forderungs-Praktiker,"18696295,18696295",Forderungspraktiker; WIKI
Baurechtliche Blätter,16137612,bbl
Wohnrechtliche Blätter,16137647,WOBL
Doping,"23669659,21921253,23669659,21921253",Zeitschrift für Sportrecht und Medizin
"Einmalzahlungen, Sonderzuwendungen",2192788X,
Steueranwaltsmagazin,16155610,
Gefahrgut aktuell,"14342170,14342170",
Forensia,0724844X,
